{
  "schema_version": "1.1.0",
  "source": {
    "system": "GCRM Marketing Advisor",
    "page_url": "https://mmm.tiktok-row.net/gcrm_overseas/phoenix/marketing-advisor/product-insights/top-product",
    "taxonomy_snapshot": "2026-07-28"
  },
  "browser": {
    "state": "evidence_collected",
    "adapter": "Aime Chrome",
    "adapter_type": "aime_chrome",
    "session_mode": "local_authenticated_browser",
    "local_authenticated_session": true,
    "attempted_paths": [
      "direct_url_then_verify",
      "dom_locator_auto_scroll",
      "level_two_dom_locator_auto_scroll"
    ]
  },
  "queries": [
    {
      "query_id": "my-kitchen-none-202607",
      "theme_rank": 1,
      "theme_name": "厨房",
      "country": "MY",
      "category": {
        "l1": "厨房用品",
        "l2": null,
        "l2_status": "not_available"
      },
      "window": {
        "start": "2026-07-01",
        "end": "2026-07-26"
      },
      "filter_url": "https://mmm.tiktok-row.net/gcrm_overseas/phoenix/marketing-advisor/product-insights/top-product?country=MY&category=kitchen",
      "captured_at": "2026-07-29T16:00:00+08:00",
      "result_status": "success",
      "row_count": 50,
      "l2_attempted": true,
      "l2_status_reason": "展开厨房用品一级类目后，第二列未显示可用二级选项",
      "proof": {
        "capture_method": "dom",
        "screenshot_ref": "gcrm-my-kitchen-none-202607.png"
      },
      "no_candidate_reason": "读取到的商品均与客户现有货盘功能重复"
    },
    {
      "query_id": "my-auto-none-202607",
      "theme_rank": 2,
      "theme_name": "车品",
      "country": "MY",
      "category": {
        "l1": "汽车与摩托车",
        "l2": null,
        "l2_status": "not_supported"
      },
      "window": {
        "start": "2026-07-01",
        "end": "2026-07-26"
      },
      "filter_url": "https://mmm.tiktok-row.net/gcrm_overseas/phoenix/marketing-advisor/product-insights/top-product?country=MY&category=auto",
      "captured_at": "2026-07-29T16:06:00+08:00",
      "result_status": "success",
      "row_count": 50,
      "l2_attempted": true,
      "l2_status_reason": "当前汽车与摩托车筛选控件未提供二级类目选择",
      "proof": {
        "capture_method": "dom",
        "screenshot_ref": "gcrm-my-auto-none-202607.png"
      },
      "no_candidate_reason": "读取到的商品均缺少与现有主题互补的场景"
    },
    {
      "query_id": "my-care-none-202607",
      "theme_rank": 3,
      "theme_name": "按摩",
      "country": "MY",
      "category": {
        "l1": "保健",
        "l2": null,
        "l2_status": "not_available"
      },
      "window": {
        "start": "2026-07-01",
        "end": "2026-07-26"
      },
      "filter_url": "https://mmm.tiktok-row.net/gcrm_overseas/phoenix/marketing-advisor/product-insights/top-product?country=MY&category=care",
      "captured_at": "2026-07-29T16:12:00+08:00",
      "result_status": "success",
      "row_count": 50,
      "l2_attempted": true,
      "l2_status_reason": "展开保健一级类目后，第二列未显示可用二级选项",
      "proof": {
        "capture_method": "dom",
        "screenshot_ref": "gcrm-my-care-none-202607.png"
      },
      "no_candidate_reason": "读取到的商品均与现有按摩类商品原型重复"
    }
  ],
  "candidates": []
}
